{
  "$schema": "https://json-schema.org/draft/2020-12/schema",
  "$id": "urn:hanamesh:product-profile:1",
  "title": "HanaMesh Product Profile v1",
  "type": "object",
  "additionalProperties": false,
  "required": [
    "schemaVersion",
    "id",
    "version",
    "label",
    "components"
  ],
  "properties": {
    "schemaVersion": {
      "const": 1
    },
    "id": {
      "type": "string",
      "pattern": "^[a-z][a-z0-9._-]{0,95}$"
    },
    "version": {
      "type": "string",
      "minLength": 1,
      "maxLength": 128,
      "description": "Must also pass strict node-semver valid() at runtime."
    },
    "label": {
      "type": "string",
      "minLength": 1,
      "maxLength": 120
    },
    "runningTaskPolicy": {
      "enum": [
        "preserve-and-pause",
        "preserve-and-drain"
      ]
    },
    "components": {
      "type": "array",
      "minItems": 1,
      "maxItems": 256,
      "items": {
        "type": "object",
        "additionalProperties": false,
        "required": [
          "id",
          "moduleName",
          "label",
          "versionRange",
          "onFailure",
          "impact"
        ],
        "properties": {
          "id": {
            "type": "string",
            "pattern": "^[a-z][a-z0-9._-]{0,95}$"
          },
          "moduleName": {
            "type": "string",
            "pattern": "^(?:@[a-z0-9._-]+/)?[a-z0-9][a-z0-9._-]*$",
            "maxLength": 214
          },
          "label": {
            "type": "string",
            "minLength": 1,
            "maxLength": 120
          },
          "versionRange": {
            "type": "string",
            "minLength": 1,
            "maxLength": 128,
            "description": "Must also pass node-semver validRange at runtime."
          },
          "onFailure": {
            "enum": [
              "block",
              "restrict",
              "notice"
            ]
          },
          "impact": {
            "type": "string",
            "minLength": 1,
            "maxLength": 300
          },
          "loaderEntryId": {
            "type": "string",
            "pattern": "^[a-zA-Z0-9._:-]+$",
            "maxLength": 256
          },
          "entrySha256": {
            "type": "string",
            "pattern": "^[a-f0-9]{64}$"
          },
          "repository": {
            "type": "string",
            "pattern": "^https://"
          }
        }
      }
    }
  }
}
